document_name,title,heading,content,tokens
Ley Orgánica de Protección de Datos Personales,categorías especiales de datos,art. 30.,"datos relativos a la salud.-las instituciones que conforman el sistema nacional de salud y
los profesionales de la salud pueden recolectar y tratar los datos relativos a la salud de sus pacientes
que estén o hubiesen estado bajo tratamiento de aquellos, de acuerdo a lo previsto en la presente
ley, en la legislación especializada sobre la materia y demás normativa dictada por la autoridad de
protección de datos personales en coordinación con la autoridad sanitaria nacional.
los responsables y encargados del tratamiento de datos así como todas las personas que
intervengan en cualquier fase de este, estarán sujetas al deber de confidencialidad, de tal manera
que se garantice una seguridad adecuada de los datos personales, incluida la protección contra el
tratamiento no autorizado o ilícito y contra su pérdida, destrucción o daño accidental, mediante la
aplicación de medidas técnicas organizativas apropiadas. esta obligación será complementaria del
secreto profesional de conformidad con cada caso.
las obligaciones establecidas en los apartados anteriores se mantendrán aun cuando hubiese
finalizado la relación del obligado con el responsable o encargado del tratamiento,
no se requerirá el consentimiento del titular para el tratamiento de datos de salud cuando ello sea
necesario por razones de interés público esencial en el ámbito de la salud, el que en todo caso
deberá ser proporcional al objetivo perseguido, respetar en lo esencial el derecho a la protección de
datos y establecer medidas adecuadas y específicas para proteger los intereses y derechos
fundamentales del titular;
asimismo, tampoco se requerirá el consentimiento del titular cuando el tratamiento sea necesario por
razones de interés público en el ámbito de la salud pública, como en el caso de amenazas
transfronterizas graves para la salud, o para garantizar elevados niveles de calidad y de seguridad
de la asistencia sanitaria y de los medicamentos o productos sanitarios, siempre y cuando se
establezcan medidas adecuadas y específicas para proteger los derechos y libertades del titular y,
en particular, el secreto profesional.
",530
Ley Orgánica de Protección de Datos Personales,categorías especiales de datos,art. 31.,"tratamiento de datos relativos a la salud.-todo tratamiento de datos relativos a la salud
deberá cumplir con los siguientes parámetros mínimos y aquellos que determine la autoridad de
protección de datos personales en la normativa emitida para el efecto:
1. los datos relativos a la salud generados en establecimientos de salud públicos o privados, serán
tratados cumpliendo los principios de confidencialidad y secreto profesional. el titular de la
información deberá brindar su consentimiento previo conforme lo determina esta ley, salvo en los
casos en que el tratamiento sea necesario para proteger intereses vitales del interesado, en el
supuesto de que el interesado no esté capacitado, física o jurídicamente, para dar su consentimiento;
o sea necesario para fines de medicina preventiva o laboral, evaluación de la capacidad laboral del
trabajador, diagnóstico médico, prestación de asistencia o tratamiento de tipo sanitario o social, o
gestión de los sistemas y servicios de asistencia sanitaria, y social, sobre la base de la legislación
especializada sobre la materia o en virtud de un contrato con un profesional sanitario. en este último
caso el tratamiento sólo podrá ser realizado por un profesional sujeto a la obligación de secreto
profesional, o bajo su responsabilidad, de acuerdo con la legislación especializada sobre la materia o
con las demás normas que al respecto pueda establecer la autoridad.
2. los datos relativos a la salud que se traten, siempre que sea posible, deberán ser previamente
anonimizados o seudonimizados, evitando la posibilidad de identificar a los titulares de los mismos.
3. todo tratamiento de datos de salud anonimizados deberá ser autorizado previamente por la
autoridad de protección de datos personales. para obtener la autorización mencionada, el
interesado deberá presentar un protocolo técnico que contenga los parámetros necesarios que
garanticen la protección de dichos datos y el informe previo favorable emitido por la autoridad
sanitaria.
",500
Ley Orgánica de Protección de Datos Personales,categorías especiales de datos,art. 32.,"tratamiento de datos de salud por entes privados y públicos con fines de investigación.-los
datos relativos a salud que consten en las instituciones que conforman el sistema nacional de salud,
podrán ser tratados por personas naturales y jurídicas privadas y públicas con fines de investigación
científica, siempre que según el caso encuentren anonimizados, o dicho tratamiento sea autorizado
por la autoridad de protección de datos personales, previo informe de la autoridad sanitaria
nacional.
",124
Ley Orgánica de Protección de Datos Personales,transferencia o comunicación y acceso a datos personales por terceros,art. 33.,"transferencia o comunicación de datos personales.-los datos personales podrán
transferirse o comunicarse a terceros cuando se realice para el cumplimiento de fines directamente
relacionados con las funciones legítimas del responsable y del destinatario, cuando la transferencia
se encuentre configurada dentro de una de las causales de legitimidad establecidas en esta ley, y
se cuente, además, con el consentimiento del titular.
se entenderá que el consentimiento es informado cuando para la transferencia o comunicación de
datos personales el responsable del tratamiento haya entregado información suficiente al titular que
le permita conocer la finalidad a que se destinarán sus datos y el tipo de actividad del tercero a quien
se pretende transferir o comunicar dichos datos.
",195
Ley Orgánica de Protección de Datos Personales,transferencia o comunicación y acceso a datos personales por terceros,art. 34.,"acceso a datos personales por parte del encargado.-no se considerará transferencia o
comunicación en el caso de que el encargado acceda a datos personales para la prestación de un
servicio al responsable del tratamiento de datos personales. el tercero que ha accedido
legítimamente a datos personales en estas consideraciones, será considerado encargado del
tratamiento.
el tratamiento de datos personales realizado por el encargado deberá estar regulado por un contrato,
en el que se establezca de manera clara y precisa que el encargado del tratamiento de datos
personales tratará únicamente los mismos conforme las instrucciones del responsable y que no los
utilizará para finalidades diferentes a las señaladas en el contrato, ni que los transferirá o comunicará
ni siquiera para su conservación a otras personas.
una vez que se haya cumplido la prestación contractual, los datos personales deberán ser
destruidos o devueltos al responsable del tratamiento de datos personales bajo la supervisión de la
autoridad de protección de datos personales.
el encargado será responsable de las infracciones derivadas del incumplimiento de las condiciones
de tratamiento de datos personales establecidas en la presente ley.
",305
Ley Orgánica de Protección de Datos Personales,transferencia o comunicación y acceso a datos personales por terceros,art. 35.,"acceso a datos personales por parte de terceros.-no se considerará transferencia o
comunicación cuando el acceso a datos personales por un tercero sea necesario para la prestación
de un servicio al responsable del tratamiento de datos personales. el tercero que ha accedido a
datos personales en estas condiciones debió hacerlo legítimamente.
el tratamiento de datos personales realizado por terceros deberá estar regulado por un contrato, en
el que se establezca de manera clara y precisa que el encargado del tratamiento de datos
personales tratará únicamente los mismos conforme las instrucciones del responsable y que no los
utilizará para finalidades diferentes a las señaladas en el contrato, ni que los transferirá o comunicará
ni siquiera para su conservación a otras personas.
una vez que se haya cumplido la prestación contractual, los datos personales deberán ser
destruidos o devueltos al responsable del tratamiento de datos personales bajo la supervisión de la
autoridad de protección de datos personales.
el tercero será responsable de las infracciones derivadas del incumplimiento de las condiciones de
tratamiento de datos personales establecidas en la presente ley.
",296
Ley Orgánica de Protección de Datos Personales,transferencia o comunicación y acceso a datos personales por terceros,art. 36.,"excepciones de consentimiento para la transferencia o comunicación de datos personales.no es necesario contar con el consentimiento del titular para la transferencia o comunicación de
datos personales, en los siguientes supuestos:
1) cuando los datos han sido recogidos de fuentes accesibles al público;
2) cuando el tratamiento responda a la libre y legítima aceptación de una relación jurídica entre el
responsable de tratamiento y el titular, cuyo desarrollo, cumplimiento y control implique
necesariamente la conexión de dicho tratamiento con base de datos. en este caso la transferencia o
comunicación sólo será legítima en cuanto se limite a la finalidad que la justifique;
3) cuando los datos personales deban proporcionarse a autoridades administrativas o judiciales en
virtud de solicitudes y órdenes amparadas en competencias atribuidas en la norma vigente;
4) cuando la comunicación se produzca entre administraciones públicas y tenga por objeto el
tratamiento posterior de datos con fines históricos, estadísticos o científicos, siempre y cuando
dichos datos se encuentren debidamente disociados o a lo menos anonimizados, y,
5) cuando la comunicación de datos de carácter personal relativos a la salud sea necesaria para
solucionar una urgencia que implique intereses vitales de su titular y este se encontrare impedido de
otorgar su consentimiento.
6) cuando la comunicación de datos de carácter personal relativos a la salud sea necesaria para
realizar los estudios epidemiológicos de interés público, dando cumplimiento a los estándares
internacionales en la materia de derechos humanos, y como mínimo a los criterios de legalidad,
proporcionalidad y necesidad. el tratamiento deberá ser de preferencia anonimizado, y en todo caso
agregado, una vez pasada la urgencia de interés público.
cuando sea requerido el consentimiento del titular para que sus datos personales sean comunicados
a un tercero, este puede revocarlo en cualquier momento, sin necesidad de que medie justificación
alguna.
la presente ley obligatoriamente debe ser aplicada por el destinatario, por el solo hecho de la
comunicación de los datos; a menos que estos hayan sido anonimizados o sometidos a un proceso
de (sic.
",552
Ley Orgánica de Protección de Datos Personales,seguridad de datos personales,art. 37.,"seguridad de datos personales.-el responsable o encargado del tratamiento de datos
personales según sea el caso, deberá sujetarse al principio de seguridad de datos personales, para
lo cual deberá tomar en cuenta las categorías y volumen de datos personales, el estado de la
técnica, mejores prácticas de seguridad integral y los costos de aplicación de acuerdo a la
naturaleza, alcance, contexto y los fines del tratamiento, así como identificar la probabilidad de
riesgos.
el responsable o encargado del tratamiento de datos personales, deberá implementar un proceso de
verificación, evaluación y valoración continua y permanente de la eficiencia, eficacia y efectividad de
las medidas de carácter técnico, organizativo y de cualquier otra índole, implementadas con el objeto
de garantizar y mejorar la seguridad del tratamiento de datos personales.
el responsable o encargado del tratamiento de datos personales deberá evidenciar que las medidas
adoptadas e implementadas mitiguen de forma adecuada los riesgos identificados
entre otras medidas, se podrán incluir las siguientes;
1) medidas de anonimización, seudonomización o cifrado de datos personales;
2) medidas dirigidas a mantener la confidencialidad, integridad y disponibilidad permanentes de los
sistemas y servicios del tratamiento de datos personales y el acceso a los datos personales, de
forma rápida en caso de incidentes; y
3) medidas dirigidas a mejorar la residencia técnica, física, administrativa, y jurídica.
4) los responsables y encargados del tratamiento de datos personales, podrán acogerse a
estándares internacionales para una adecuada gestión de riesgos enfocada a la protección de
derechos y libertades, así como para la implementación y manejo de sistemas de seguridad de la
información o a códigos de conducta reconocidos y autorizados por la autoridad de protección de
datos personales.
",468
Ley Orgánica de Protección de Datos Personales,seguridad de datos personales,art. 38.,"medidas de seguridad en el ámbito del sector público.-el mecanismo gubernamental de
seguridad de la información deberá incluir las medidas que deban implementarse en el caso de
tratamiento de datos personales para hacer frente a cualquier riesgo, amenaza, vulnerabilidad,
accesos no autorizados, pérdidas, alteraciones, destrucción o comunicación accidental o ilícita en el
tratamiento de los datos conforme al principio de seguridad de datos personales.
el mecanismo gubernamental de seguridad de la información abarcará y aplicará a todas las
instituciones del sector público, contenidas en el artículo 225 de la constitución de la república de
ecuador, así como a terceros que presten servicios públicos mediante concesión u otras figuras
legalmente reconocidas. estas, podrán incorporar medidas adicionales al mecanismo gubernamental
de seguridad de la información.
",218
Ley Orgánica de Protección de Datos Personales,seguridad de datos personales,art. 39.,"protección de datos personales desde el diseño y por defecto.-se entiende a la protección
de datos desde el diseño como el deber del responsable del tratamiento de tener en cuenta, en las
primeras fases de concepción y diseño del proyecto, que determinados tipos de tratamientos de
datos personales entrañan una serie de riesgos para los derechos de los titulares en atención al
estado de la técnica, naturaleza y fines del tratamiento, para lo cual, implementará las medidas
técnicas, organizativas y de cualquier otra índole, con miras a garantizar el cumplimiento de las
obligaciones en materia de protección de datos, en los términos del reglamento.
la protección de datos por defecto hace referencia a que el responsable debe aplicar las medidas
técnicas y organizativas adecuadas con miras a que, por defecto, solo sean objeto de tratamiento los
datos personales que sean necesarios para cada uno de los fines del tratamiento, en los términos del
reglamento.
",241
Ley Orgánica de Protección de Datos Personales,seguridad de datos personales,art. 40.,"análisis de riesgo, amenazas y vulnerabilidades.-para el análisis de riesgos, amenazas y
vulnerabilidades, el responsable y el encargado del tratamiento de los datos personales deberán
utilizar una metodología que considere, entre otras:
1) las particularidades del tratamiento;
2) las particularidades de las partes involucradas; y,
3) las categorías y el volumen de datos personales objeto de tratamiento.
",102
Ley Orgánica de Protección de Datos Personales,seguridad de datos personales,art. 41.,"determinación de medidas de seguridad aplicables.-para determinar las medidas de
seguridad, aceptadas por el estado de la técnica, a las que están obligadas el responsable y el
encargado del tratamiento de los datos personales, se deberán tomar en consideración, entre otros:
1) los resultados del análisis de riesgos, amenazas y vulnerabilidades;
2) la naturaleza de los datos personales;
3) las características de las partes involucradas; y,
4) los antecedentes de destrucción de datos personales, la pérdida, alteración, divulgación o
impedimento de acceso a los mismos por parte del titular, sean accidentales e intencionales, por
acción u omisión, así como los antecedentes de transferencia, comunicación o de acceso no
autorizado o exceso de autorización de tales datos.
el responsable y el encargado del tratamiento de datos personales deberán tomar las medidas
adecuadas y necesarias, de forma permanente y continua, para evaluar, prevenir, impedir, reducir,
mitigar y controlar los riesgos, amenazas y vulnerabilidades, incluidas las que conlleven un alto
riesgo para los derechos y libertades del titular, de conformidad con la normativa que emita la
autoridad de protección de datos personales.
",302
Ley Orgánica de Protección de Datos Personales,seguridad de datos personales,art. 42.,"evaluación de impacto del tratamiento de datos personales.-el responsable realizará una
evaluación de impacto del tratamiento de datos personales cuando se haya identificado la
probabilidad de que dicho tratamiento, por su naturaleza, contexto o fines, conlleve un alto riesgo
para los derechos y libertades del titular o cuando la autoridad de protección de datos personales lo
requiera.
la evaluación de impacto relativa a la protección de los datos será de carácter obligatoria en caso
de:
a) evaluación sistemática y exhaustiva de aspectos personales de personas físicas que se base en
un tratamiento automatizado, como la elaboración de perfiles, y sobre cuya base se tomen
decisiones que produzcan efectos jurídicos para las personas naturales;
b) tratamiento a gran escala de las categorías especiales de datos, o de los datos personales
relativos a condenas e infracciones penales, o
c) observación sistemática a gran escala de una zona de acceso público.
la autoridad de protección de datos personales establecerá otros tipos de operaciones de
tratamiento que requieran una evaluación de impacto relativa a la protección de datos.
la evaluación de impacto deberá efectuarse previo al inicio del tratamiento de datos personales.
",309
Ley Orgánica de Protección de Datos Personales,seguridad de datos personales,art. 43.,"notificación de vulneración de seguridad.-el responsable del tratamiento deberá notificar la
vulneración de la seguridad de datos personales a la autoridad de protección de datos personales y
la agencia de regulación y control de las telecomunicaciones, tan pronto sea posible, y a más
tardar en el término de cinco (5) días después de que haya tenido constancia de ella, a menos que
sea improbable que dicha violación de la seguridad constituya un riesgo para los derechos y las
libertades de las personas físicas. si la notificación a la autoridad de protección de datos no tiene
lugar en el término de cinco (5) días, deberá ir acompañada de indicación de los motivos de la
dilación.
el encargado del tratamiento deberá notificar al responsable cualquier vulneración de la seguridad de
datos personales tan pronto sea posible, y a más tardar dentro del término de dos (2) días contados
a partir de la fecha en la que tenga conocimiento de ella.
",237
Ley Orgánica de Protección de Datos Personales,seguridad de datos personales,art. 44.,"acceso a datos personales para atención a emergencias e incidentes informáticos.-las
autoridades públicas competentes, los equipos de respuesta de emergencias informáticas, los
equipos de respuesta a incidentes de seguridad informática, los centros de operaciones de
seguridad, los prestadores y proveedores de servicios de telecomunicaciones y los proveedores de
tecnología y servicios de seguridad, nacionales e internacionales, podrán acceder y efectuar
tratamientos sobre los datos personales contenidos en las notificaciones de vulneración a las
seguridades, durante el tiempo necesario, exclusivamente para la detección, análisis, protección y
respuesta ante cualquier tipo de incidentes así como para adoptar e implementar medidas de
seguridad adecuadas y proporcionadas a los riesgos identificados.
",202
Ley Orgánica de Protección de Datos Personales,seguridad de datos personales,art. 45.,"garantía del secreto de las comunicaciones y seguridad de datos personales.-para la
correcta prestación de los servicios de telecomunicaciones y la apropiada operación de redes de
telecomunicaciones, los prestadores de servicios de telecomunicaciones deben garantizar el secreto
de las comunicaciones y seguridad de datos personales. únicamente por orden judicial, los
prestadores de servicios de telecomunicaciones podrán utilizar equipos, infraestructuras e
instalaciones que permitan grabar los contenidos de las comunicaciones específicas dispuestas por
los jueces competentes. si se evidencia un tratamiento de grabación o interceptación de las
comunicaciones no autorizadas por orden judicial, se aplicará lo dispuesto en la presente ley.
",186
Ley Orgánica de Protección de Datos Personales,seguridad de datos personales,art. 46.,"notificación de vulneración de seguridad al titular.-el responsable del tratamiento deberá
notificar sin dilación la vulneración de seguridad de datos personales al titular cuando conlleve un
riesgo a sus derechos fundamentales y libertades individuales, dentro del término de tres días
contados a partir de la fecha en la que tuvo conocimiento del riesgo.
no se deberá notificar la vulneración de seguridad de datos personales al titular en los siguientes
casos:
1. cuando el responsable del tratamiento haya adoptado medidas de protección técnicas
organizativas o de cualquier otra índole apropiadas aplicadas a los datos personales afectados por la
vulneración de seguridad que se pueda demostrar que son efectivas;
2. cuando el responsable del tratamiento haya tomado medidas que garanticen que el riesgo para
los derechos fundamentales y las libertades individuales del titular, no ocurrirá; y,
3. cuando se requiera un esfuerzo desproporcionado para hacerlo; en cuyo caso, el responsable del
tratamiento deberá realizar una comunicación pública a través de cualquier medio en la que se
informe de la vulneración de seguridad de datos personales a los titulares.
la procedencia de las excepciones de les numerales 1 y 2 deberá ser calificada por la autoridad de
protección de datos, una vez informada esta tan pronto sea posible, y en cualquier caso dentro de
los plazos contemplados en el artículo 43.
la notificación al titular del dato objeto de la vulneración de seguridad contendrá lo señalado en el
artículo 43 de esta ley.
en caso de que el responsable del tratamiento de los datos personales no cumpliese oportunamente
y de modo justificado con la notificación será sancionado conforme al régimen sancionatorio previsto
en esta ley.
la notificación oportuna de la violación por parte del responsable de tratamiento al titular y la
ejecución oportuna de medidas de respuesta, serán consideradas atenuante de la infra (sic.
",484
